{
  "shortSummary": "기술 기반 지식은 탄탄하나 실전 경험과 구체적 수치 제시가 부족. 협업 역량은 긍정적.",
  "strengths": [
    "Spring과 JPA 등 핵심 백엔드 기술 스택에 대한 이해가 깊음",
    "팀 협업 경험이 풍부하고 커뮤니케이션이 명확함"
  ],
  "weaknesses": [
    "답변에 구체적인 수치나 성과 지표가 부족함",
    "CS 기초 질문에서 원리보다 암기 위주의 설명이 나타남"
  ],
  "nextActions": [
    "프로젝트 경험을 STAR 구조로 정리하고 수치화된 성과를 준비할 것",
    "GC, 네트워크 등 CS 기초 원리를 코드 레벨에서 설명하는 연습 필요"
  ],
  "qualityFlags": []
}
